{
  "$schema": "model-order.schema.json",
  "schemaVersion": 1,
  "revision": "1",
  "ignoredSuffixes": ["-non-reasoning", "-extra-high", "-very-high", "-xhigh", "-minimal", "-medium", "-high", "-low", "-none"],
  "providers": [
    {
      "id": "openai",
      "aliases": ["open-ai"],
      "patterns": ["^(?:gpt-|chatgpt-|codex-|dall-e|text-|tts-|whisper-|sora-|computer-use-|o[0-9]).*$"],
      "families": [
        {
          "id": "gpt",
          "patterns": ["^(?:gpt|chatgpt)-(?P<version>[0-9]+(?:\\.[0-9]+)*)(?:-?(?P<variant>[a-z].*))?$"],
          "classes": [
            {"id": "astra", "aliases": ["astra"]},
            {"id": "sol", "aliases": ["sol"]},
            {"id": "terra", "aliases": ["terra"]},
            {"id": "luna", "aliases": ["luna"]},
            {"id": "base", "aliases": []}
          ],
          "variants": ["", "pro", "codex", "codex-spark", "mini", "nano", "chat", "instruct", "audio", "realtime", "preview", "latest"]
        },
        {
          "id": "o",
          "patterns": ["^o(?P<version>[0-9]+(?:\\.[0-9]+)*)(?:-(?P<variant>.*))?$"],
          "classes": [],
          "variants": ["", "pro", "mini", "preview", "latest"]
        },
        {
          "id": "codex",
          "patterns": ["^codex-(?P<variant>.*?)(?P<version>[0-9]+(?:\\.[0-9]+)*)(?:-(?P<suffix>.*))?$", "^codex(?:-(?P<variant>.*))?$"],
          "classes": [],
          "variants": ["", "max", "mini", "preview", "latest"]
        },
        {
          "id": "gpt-image",
          "patterns": ["^gpt-image-(?P<version>[0-9]+(?:\\.[0-9]+)*)(?:-(?P<variant>.*))?$"],
          "classes": [],
          "variants": ["sunburst", "flare", "", "mini", "preview", "latest"]
        },
        {
          "id": "dall-e",
          "patterns": ["^dall-e-(?P<version>[0-9]+)(?:-(?P<variant>.*))?$"],
          "classes": [],
          "variants": [""]
        },
        {
          "id": "sora",
          "patterns": ["^sora-(?P<version>[0-9]+(?:\\.[0-9]+)*)(?:-(?P<variant>.*))?$"],
          "classes": [],
          "variants": ["", "pro"]
        },
        {
          "id": "tts",
          "patterns": ["^tts-(?P<version>[0-9]+)(?:-(?P<variant>.*))?$"],
          "classes": [],
          "variants": ["", "hd"]
        },
        {
          "id": "whisper",
          "patterns": ["^whisper-(?P<version>[0-9]+)(?:-(?P<variant>.*))?$"],
          "classes": [],
          "variants": [""]
        }
      ]
    },
    {
      "id": "anthropic",
      "aliases": [],
      "patterns": ["^claude-.*$"],
      "families": [
        {
          "id": "claude",
          "patterns": [
            "^claude-(?P<variant>[a-z][a-z-]*?)-(?P<version>[0-9]+(?:[.-][0-9]+)*)(?:-(?P<suffix>.*))?$",
            "^claude-(?P<version>[0-9]+(?:[.-][0-9]+)*)(?:-(?P<variant>.*))?$",
            "^claude-(?P<variant>.*)$"
          ],
          "classes": [
            {"id": "fable", "aliases": ["fable"]},
            {"id": "opus", "aliases": ["opus"]},
            {"id": "sonnet", "aliases": ["sonnet"]},
            {"id": "haiku", "aliases": ["haiku"]}
          ],
          "variants": ["", "thinking", "preview", "latest"]
        }
      ]
    },
    {
      "id": "google",
      "aliases": ["google-ai", "google-ai-studio"],
      "patterns": ["^(?:gemini-|gemma-|imagen-|veo-).*$"],
      "families": [
        {
          "id": "gemini",
          "patterns": ["^gemini-(?P<version>[0-9]+(?:\\.[0-9]+)*)(?:-(?P<variant>.*))?$", "^gemini-(?P<variant>.*)$"],
          "classes": [
            {"id": "pro", "aliases": ["pro"]},
            {"id": "flash", "aliases": ["flash"]},
            {"id": "flash-lite", "aliases": ["flash-lite"]}
          ],
          "variants": ["", "preview", "latest", "thinking", "image", "image-preview", "live"]
        },
        {
          "id": "gemma",
          "patterns": ["^gemma-?(?P<version>[0-9]+(?:\\.[0-9]+)*)(?:-(?P<variant>.*))?$"],
          "classes": [],
          "variants": [""]
        },
        {
          "id": "imagen",
          "patterns": ["^imagen-(?P<version>[0-9]+(?:\\.[0-9]+)*)(?:-(?P<variant>.*))?$"],
          "classes": [],
          "variants": ["ultra", "", "fast", "generate"]
        },
        {
          "id": "veo",
          "patterns": ["^veo-(?P<version>[0-9]+(?:\\.[0-9]+)*)(?:-(?P<variant>.*))?$"],
          "classes": [],
          "variants": ["", "fast", "generate", "preview"]
        }
      ]
    },
    {
      "id": "xai",
      "aliases": ["x-ai", "x_ai"],
      "patterns": ["^grok-.*$"],
      "families": [
        {
          "id": "grok",
          "patterns": ["^grok-(?P<version>[0-9]+(?:\\.[0-9]+)*)(?:-(?P<variant>.*))?$", "^grok-(?P<variant>.*)$"],
          "classes": [],
          "variants": ["", "heavy", "fast", "mini", "code", "vision", "image", "preview", "latest"]
        }
      ]
    },
    {
      "id": "deepseek",
      "aliases": ["deep-seek"],
      "patterns": ["^deepseek-.*$"],
      "families": [
        {
          "id": "deepseek-v",
          "patterns": [
            "^deepseek-(?:chat-)?v(?P<version>[0-9]+(?:\\.[0-9]+)*)(?:-(?P<variant>.*?))??(?:-(?P<snapshot_day>[0-9]{4}))?$",
            "^deepseek-(?P<variant>chat|latest)$"
          ],
          "classes": [
            {"id": "pro", "aliases": ["pro"]},
            {"id": "flash", "aliases": ["flash"]},
            {"id": "base", "aliases": []}
          ],
          "variants": ["", "chat", "latest", "terminus", "thinking", "vision", "vision-exp", "exp"]
        },
        {
          "id": "deepseek-r",
          "patterns": [
            "^deepseek-r(?P<version>[0-9]+(?:\\.[0-9]+)*)(?:-(?P<snapshot_day>[0-9]{4}))?(?:-(?P<variant>.*))?$",
            "^deepseek-(?P<variant>reasoner)$"
          ],
          "classes": [],
          "variants": ["", "reasoner", "thinking", "distill"]
        },
        {
          "id": "deepseek-coder",
          "patterns": ["^deepseek-coder(?:-v(?P<version>[0-9]+(?:\\.[0-9]+)*))?(?:-(?P<variant>.*))?$"],
          "classes": [],
          "variants": ["", "instruct", "lite", "base"]
        },
        {
          "id": "deepseek-math",
          "patterns": ["^deepseek-math(?:-v(?P<version>[0-9]+(?:\\.[0-9]+)*))?(?:-(?P<variant>.*))?$"],
          "classes": [],
          "variants": ["", "instruct", "base"]
        },
        {
          "id": "deepseek-ocr",
          "patterns": ["^deepseek-ocr(?:-(?P<version>[0-9]+(?:\\.[0-9]+)*))?(?:-(?P<variant>.*))?$"],
          "classes": [],
          "variants": [""]
        }
      ]
    },
    {
      "id": "zai",
      "aliases": ["z-ai", "z_ai", "zhipuai", "zhipu-ai"],
      "patterns": ["^(?:glm-|autoglm-).*$"],
      "families": [
        {
          "id": "glm",
          "patterns": ["^glm-(?P<version>[0-9]+(?:\\.[0-9]+)*)(?:-(?P<variant>.*))?$"],
          "classes": [
            {"id": "prime", "aliases": ["prime"]},
            {"id": "base", "aliases": []},
            {"id": "turbo", "aliases": ["turbo"]},
            {"id": "air", "aliases": ["air"]},
            {"id": "flashx", "aliases": ["flashx"]},
            {"id": "flash", "aliases": ["flash"]}
          ],
          "variants": ["", "thinking", "preview", "latest"]
        },
        {
          "id": "glm-vision",
          "patterns": ["^glm-(?P<version>[0-9]+(?:\\.[0-9]+)*)v(?:-(?P<variant>.*))?$"],
          "classes": [
            {"id": "base", "aliases": []},
            {"id": "turbo", "aliases": ["turbo"]},
            {"id": "flash", "aliases": ["flash"]}
          ],
          "variants": ["", "thinking", "preview", "latest"]
        },
        {
          "id": "autoglm",
          "patterns": ["^autoglm-(?P<variant>.*)$"],
          "classes": [],
          "variants": [""]
        },
        {
          "id": "glm-image",
          "patterns": ["^glm-image(?:-(?P<version>[0-9]+(?:\\.[0-9]+)*))?(?:-(?P<variant>.*))?$"],
          "classes": [],
          "variants": [""]
        }
      ]
    },
    {
      "id": "alibaba",
      "aliases": ["qwen", "alibaba-cloud", "dashscope", "aliyun"],
      "patterns": ["^(?:qwen-?[0-9]|qwen-|qwq-|qvq-|wan-).*$"],
      "families": [
        {
          "id": "qwen",
          "patterns": [
            "^qwen-?(?P<version>[0-9]+(?:[.-][0-9]{1,2})*)(?:-(?P<parameters>[0-9]+(?:\\.[0-9]+)*[bt])(?:-a[0-9]+(?:\\.[0-9]+)*[bt])?)?(?:-(?P<variant>(?:max|plus|turbo|flash|next|instruct|thinking)(?:-.*?)??))??(?:-(?:(?P<snapshot>[2-9][0-9](?:0[1-9]|1[0-2]))|(?P<snapshot_day>[0-1][0-9]-?[0-3][0-9])))?$",
            "^qwen-(?P<variant>(?:max|plus|turbo|flash)(?:-.*?)??)(?:-(?P<snapshot>[0-9]{4}))?$"
          ],
          "classes": [
            {"id": "max", "aliases": ["max"]},
            {"id": "plus", "aliases": ["plus"]},
            {"id": "turbo", "aliases": ["turbo"]},
            {"id": "flash", "aliases": ["flash"]},
            {"id": "base", "aliases": []}
          ],
          "variants": ["prime", "", "next", "instruct", "thinking", "preview", "latest"]
        },
        {
          "id": "qwen-coder",
          "patterns": [
            "^qwen-?(?P<version>[0-9]+(?:[.-][0-9]{1,2})*)-coder(?:-(?P<parameters>[0-9]+(?:\\.[0-9]+)*[bt])(?:-a[0-9]+(?:\\.[0-9]+)*[bt])?)?(?:-(?P<variant>.*?))??(?:-(?P<snapshot>[0-9]{4}))?$",
            "^qwen-coder(?:-(?P<variant>.*))?$"
          ],
          "classes": [
            {"id": "plus", "aliases": ["plus"]},
            {"id": "flash", "aliases": ["flash"]},
            {"id": "base", "aliases": []}
          ],
          "variants": ["next", "", "instruct", "thinking", "preview", "latest"]
        },
        {
          "id": "qwen-vl",
          "patterns": [
            "^qwen-?(?P<version>[0-9]+(?:[.-][0-9]{1,2})*)-vl(?:-(?P<parameters>[0-9]+(?:\\.[0-9]+)*[bt])(?:-a[0-9]+(?:\\.[0-9]+)*[bt])?)?(?:-(?P<variant>.*?))??(?:-(?P<snapshot>[0-9]{4}))?$",
            "^qwen-vl(?:-(?P<variant>.*))?$"
          ],
          "classes": [
            {"id": "max", "aliases": ["max"]},
            {"id": "plus", "aliases": ["plus"]},